{
  "$schema": "https://json-schema.org/draft/2020-12/schema",
  "$id": "clippers/schemas/transcript-evidence-v1.schema.json",
  "title": "Clippers Transcript Evidence",
  "type": "object",
  "additionalProperties": false,
  "required": ["schema_version", "source_id", "format", "artifact", "segments"],
  "properties": {
    "schema_version": {"const": 1},
    "source_id": {"type": "string", "minLength": 1},
    "format": {"enum": ["structured_json", "vtt"]},
    "artifact": {"type": "string", "minLength": 1},
    "segments": {
      "type": "array", "minItems": 1,
      "items": {
        "type": "object", "additionalProperties": false,
        "required": ["start_ms", "end_ms", "text"],
        "properties": {
          "start_ms": {"type": "integer", "minimum": 0},
          "end_ms": {"type": "integer", "minimum": 1},
          "text": {"type": "string", "minLength": 1},
          "speaker": {"type": ["string", "null"]}
        }
      }
    }
  }
}
