{
  "schema_version": 1,
  "source_id": "authorized_example_source",
  "format": "structured_json",
  "artifact": "runs/2026-09-17-example/evidence/transcript.vtt",
  "segments": [
    {"start_ms": 9800, "end_ms": 15400, "speaker": "Host", "text": "The rule is simple: prove where the moment begins."},
    {"start_ms": 15500, "end_ms": 40200, "speaker": "Host", "text": "If the timestamp is wrong, the edit is built on nothing."}
  ]
}
